2025-07-09 11:18:44,448 - __main__ - INFO - 🧪 KICKAI E2E Test Runner
2025-07-09 11:18:44,448 - __main__ - INFO - 📋 Available suites: chat_id_validation, player_registration, match_management, payment_processing, natural_language, admin_operations, status, error_handling, comprehensive, smoke
2025-07-09 11:18:44,448 - __main__ - INFO - 🚀 Starting test suite: status
2025-07-09 11:18:44,449 - __main__ - INFO -  Validating environment configuration...
2025-07-09 11:18:44,449 - __main__ - INFO - ✅ TELEGRAM_BOT_TOKEN: 76933590...NYsM
2025-07-09 11:18:44,449 - __main__ - INFO - ✅ TELEGRAM_API_ID: 23493061
2025-07-09 11:18:44,449 - __main__ - INFO - ✅ TELEGRAM_API_HASH: bd2e45dd...e6a5
2025-07-09 11:18:44,449 - __main__ - INFO - ✅ ADMIN_SESSION_STRING: 1BJWap1s...vvY=
2025-07-09 11:18:44,449 - __main__ - INFO - ✅ TELEGRAM_MAIN_CHAT_ID: -4889304885
2025-07-09 11:18:44,449 - __main__ - INFO - ✅ TELEGRAM_LEADERSHIP_CHAT_ID: -4814449926
2025-07-09 11:18:44,449 - __main__ - INFO - ✅ DEFAULT_TEAM_ID: KAI
2025-07-09 11:18:44,449 - __main__ - INFO - ✅ FIREBASE_PROJECT_ID: kickai-954c2
2025-07-09 11:18:44,449 - __main__ - INFO - ✅ Environment validation passed
2025-07-09 11:18:44,449 - __main__ - INFO - 📱 Chat Configuration:
2025-07-09 11:18:44,449 - __main__ - INFO -    Main Chat ID: -4889304885 (KickAI Testing)
2025-07-09 11:18:44,449 - __main__ - INFO -    Leadership Chat ID: -4814449926 (KickAI Testing - Leadership)
2025-07-09 11:18:44,449 - __main__ - INFO -    Naming Convention: 'Team Name' for main, 'Team Name - Leadership' for leadership
2025-07-09 11:18:44,449 - src.core.improved_config_system - INFO - E2E testing detected, loading .env.test
2025-07-09 11:18:44,450 - src.core.improved_config_system - INFO - Loaded environment variables from .env.test
2025-07-09 11:18:44,450 - src.core.improved_config_system - INFO -  EnvironmentConfigurationSource.load_configuration called
2025-07-09 11:18:44,451 - src.core.improved_config_system - INFO - Loaded configuration from EnvironmentConfigurationSource
2025-07-09 11:18:44,451 - src.core.improved_config_system - INFO - Loaded configuration from DefaultConfigurationSource
2025-07-09 11:18:44,451 - src.core.improved_config_system - INFO -  Merged configuration AI section: {'provider': <AIProvider.OLLAMA: 'ollama'>, 'api_key': 'ollama_local', 'model_name': 'llama3.1:8b-instruct-q4_0', 'temperature': 0.7, 'max_tokens': 1000, 'timeout_seconds': 60, 'source': <ConfigSource.ENVIRONMENT: 'environment'>}
2025-07-09 11:18:44,451 - src.core.improved_config_system - INFO - Configuration validation passed
2025-07-09 11:18:44,451 - __main__ - INFO - 📋 Team ID: KAI
2025-07-09 11:18:44,451 - __main__ - INFO - 🔧 Initializing test components...
2025-07-09 11:18:44,451 - src.testing.e2e_framework - INFO - ✅ TelegramBotTester initialized
2025-07-09 11:18:44,516 - src.testing.e2e_framework - INFO - ✅ FirestoreValidator initialized for project kickai-954c2
2025-07-09 11:18:44,516 - __main__ - INFO - 📱 Starting Telegram tester...
2025-07-09 11:18:44,516 - telethon.network.mtprotosender - INFO - Connecting to 149.154.167.91:443/TcpFull...
2025-07-09 11:18:44,545 - telethon.network.mtprotosender - INFO - Connection to 149.154.167.91:443/TcpFull complete!
2025-07-09 11:18:44,813 - src.testing.e2e_framework - INFO - ✅ Telegram client started
2025-07-09 11:18:44,814 - __main__ - INFO - ✅ Telegram tester started successfully
2025-07-09 11:18:44,814 - src.testing.e2e_framework - INFO - ✅ E2ETestRunner initialized
2025-07-09 11:18:44,814 - src.utils.id_generator - INFO - Generated player ID 'JS' for 'John Smith'
2025-07-09 11:18:44,814 - src.utils.id_generator - INFO - Generated player ID 'JS1' for 'John Smith'
2025-07-09 11:18:44,814 - src.utils.id_generator - INFO - Generated player ID 'JS2' for 'John Smith'
2025-07-09 11:18:44,814 - src.utils.id_generator - INFO - Generated player ID 'JS3' for 'John Smith'
2025-07-09 11:18:44,814 - __main__ - INFO - 📋 Loaded 4 tests for suite 'status'
2025-07-09 11:18:44,814 - __main__ - INFO -    1. Player Status Check
2025-07-09 11:18:44,814 - __main__ - INFO -    2. Admin Status Check by Phone
2025-07-09 11:18:44,814 - __main__ - INFO -    3. Admin Status Check by Player ID
2025-07-09 11:18:44,814 - __main__ - INFO -    4. Status Check for Non-Existent Player
2025-07-09 11:18:44,814 - __main__ - INFO - 🧪 Running tests...
2025-07-09 11:18:44,814 - src.testing.e2e_framework - INFO - 🚀 Starting E2E test suite with 4 tests
2025-07-09 11:18:44,814 - src.testing.e2e_framework - INFO - 📋 Running test 1/4: command
2025-07-09 11:18:44,861 - src.testing.e2e_framework - INFO - ✅ Message sent: /status...
2025-07-09 11:18:45,151 - src.testing.e2e_framework - INFO - ✅ PASS Test 1: Command + Validation: /status (0.34s)
2025-07-09 11:18:45,151 - src.testing.e2e_framework - INFO - 📋 Running test 2/4: command
2025-07-09 11:18:45,197 - src.testing.e2e_framework - INFO - ✅ Message sent: /status +447871521581...
2025-07-09 11:18:45,306 - src.testing.e2e_framework - INFO - ✅ PASS Test 2: Command + Validation: /status +447871521581 (0.15s)
2025-07-09 11:18:45,306 - src.testing.e2e_framework - INFO - 📋 Running test 3/4: command
2025-07-09 11:18:45,348 - src.testing.e2e_framework - INFO - ✅ Message sent: /status JS...
2025-07-09 11:18:45,428 - src.testing.e2e_framework - INFO - ✅ PASS Test 3: Command + Validation: /status JS (0.12s)
2025-07-09 11:18:45,429 - src.testing.e2e_framework - INFO - 📋 Running test 4/4: command
2025-07-09 11:18:45,476 - src.testing.e2e_framework - INFO - ✅ Message sent: /status +44123456789...
2025-07-09 11:18:45,518 - src.testing.e2e_framework - INFO - ✅ PASS Test 4: Command: /status +44123456789 (0.09s)
2025-07-09 11:18:45,519 - src.testing.e2e_framework - INFO -  Test suite completed. 4/4 tests passed
2025-07-09 11:18:45,519 - __main__ - INFO - 

🧪 KICKAI E2E Test Report
==================================================

📊 Summary:
• Total Tests: 4
• Passed: 4 (100.0%)
• Failed: 0 (0.0%)
• Average Duration: 0.18s

📋 Test Types:
• Integration: 3
• Command: 1

️ Performance:
• Total Duration: 0.70s
• Fastest Test: 0.09s
• Slowest Test: 0.34s

❌ Failed Tests:

2025-07-09 11:18:45,519 - __main__ - INFO - 📄 Detailed report saved to: e2e_report_status_20250709_111845.html
2025-07-09 11:18:45,519 - __main__ - INFO -  All tests passed!
2025-07-09 11:18:45,519 - __main__ - INFO - 🧹 Cleaning up...
2025-07-09 11:18:45,520 - telethon.network.mtprotosender - INFO - Disconnecting from 149.154.167.91:443/TcpFull...
2025-07-09 11:18:45,520 - telethon.network.mtprotosender - INFO - Disconnection from 149.154.167.91:443/TcpFull complete!
2025-07-09 11:18:45,520 - src.testing.e2e_framework - INFO - ✅ Telegram client stopped
2025-07-09 11:18:45,521 - __main__ - INFO - ✅ Cleanup completed
