2025-07-09 00:23:17,064 - __main__ - INFO - 🧪 KICKAI E2E Test Runner
2025-07-09 00:23:17,064 - __main__ - INFO - 📋 Available suites: chat_id_validation, player_registration, match_management, payment_processing, natural_language, admin_operations, comprehensive, smoke
2025-07-09 00:23:17,065 - __main__ - INFO - 🚀 Starting test suite: player_registration
2025-07-09 00:23:17,065 - __main__ - INFO -  Validating environment configuration...
2025-07-09 00:23:17,065 - __main__ - INFO - ✅ TELEGRAM_BOT_TOKEN: 76933590...NYsM
2025-07-09 00:23:17,065 - __main__ - INFO - ✅ TELEGRAM_API_ID: 23493061
2025-07-09 00:23:17,065 - __main__ - INFO - ✅ TELEGRAM_API_HASH: bd2e45dd...e6a5
2025-07-09 00:23:17,065 - __main__ - INFO - ✅ ADMIN_SESSION_STRING: 1BJWap1s...vvY=
2025-07-09 00:23:17,065 - __main__ - INFO - ✅ TELEGRAM_MAIN_CHAT_ID: -4889304885
2025-07-09 00:23:17,065 - __main__ - INFO - ✅ TELEGRAM_LEADERSHIP_CHAT_ID: -4814449926
2025-07-09 00:23:17,065 - __main__ - INFO - ✅ DEFAULT_TEAM_ID: KAI
2025-07-09 00:23:17,065 - __main__ - INFO - ✅ FIREBASE_PROJECT_ID: kickai-954c2
2025-07-09 00:23:17,065 - __main__ - INFO - ✅ Environment validation passed
2025-07-09 00:23:17,065 - __main__ - INFO - 📱 Chat Configuration:
2025-07-09 00:23:17,065 - __main__ - INFO -    Main Chat ID: -4889304885 (KickAI Testing)
2025-07-09 00:23:17,065 - __main__ - INFO -    Leadership Chat ID: -4814449926 (KickAI Testing - Leadership)
2025-07-09 00:23:17,065 - __main__ - INFO -    Naming Convention: 'Team Name' for main, 'Team Name - Leadership' for leadership
2025-07-09 00:23:17,065 - src.core.improved_config_system - INFO - E2E testing detected, loading .env.test
2025-07-09 00:23:17,066 - src.core.improved_config_system - INFO - Loaded environment variables from .env.test
2025-07-09 00:23:17,066 - src.core.improved_config_system - INFO -  EnvironmentConfigurationSource.load_configuration called
2025-07-09 00:23:17,067 - src.core.improved_config_system - INFO - Loaded configuration from EnvironmentConfigurationSource
2025-07-09 00:23:17,067 - src.core.improved_config_system - INFO - Loaded configuration from DefaultConfigurationSource
2025-07-09 00:23:17,067 - src.core.improved_config_system - INFO -  Merged configuration AI section: {'provider': <AIProvider.OLLAMA: 'ollama'>, 'api_key': 'ollama_local', 'model_name': 'llama3.1:8b-instruct-q4_0', 'temperature': 0.7, 'max_tokens': 1000, 'timeout_seconds': 60, 'source': <ConfigSource.ENVIRONMENT: 'environment'>}
2025-07-09 00:23:17,067 - src.core.improved_config_system - INFO - Configuration validation passed
2025-07-09 00:23:17,067 - __main__ - INFO - 📋 Team ID: KAI
2025-07-09 00:23:17,067 - __main__ - INFO - 🔧 Initializing test components...
2025-07-09 00:23:17,067 - src.testing.e2e_framework - INFO - ✅ TelegramBotTester initialized
2025-07-09 00:23:17,131 - src.testing.e2e_framework - INFO - ✅ FirestoreValidator initialized for project kickai-954c2
2025-07-09 00:23:17,131 - __main__ - INFO - 📱 Starting Telegram tester...
2025-07-09 00:23:17,131 - telethon.network.mtprotosender - INFO - Connecting to 149.154.167.91:443/TcpFull...
2025-07-09 00:23:17,162 - telethon.network.mtprotosender - INFO - Connection to 149.154.167.91:443/TcpFull complete!
2025-07-09 00:23:17,380 - src.testing.e2e_framework - INFO - ✅ Telegram client started
2025-07-09 00:23:17,380 - __main__ - INFO - ✅ Telegram tester started successfully
2025-07-09 00:23:17,380 - src.testing.e2e_framework - INFO - ✅ E2ETestRunner initialized
2025-07-09 00:23:17,380 - src.utils.id_generator - INFO - Generated player ID 'JS' for 'John Smith'
2025-07-09 00:23:17,380 - src.utils.id_generator - INFO - Generated player ID 'JS1' for 'John Smith'
2025-07-09 00:23:17,380 - __main__ - INFO - 📋 Loaded 4 tests for suite 'player_registration'
2025-07-09 00:23:17,380 - __main__ - INFO -    1. Admin Adds Player
2025-07-09 00:23:17,380 - __main__ - INFO -    2. Player Completes Registration
2025-07-09 00:23:17,380 - __main__ - INFO -    3. Query Registration Status
2025-07-09 00:23:17,380 - __main__ - INFO -    4. Admin Approves Player
2025-07-09 00:23:17,380 - __main__ - INFO - 🧪 Running tests...
2025-07-09 00:23:17,380 - src.testing.e2e_framework - INFO - 🚀 Starting E2E test suite with 4 tests
2025-07-09 00:23:17,380 - src.testing.e2e_framework - INFO - 📋 Running test 1/4: command
2025-07-09 00:23:17,424 - src.testing.e2e_framework - INFO - ✅ Message sent: /add John Smith 07123456789...
2025-07-09 00:23:17,621 - src.testing.e2e_framework - INFO - ❌ FAIL Test 1: Command + Validation: /add John Smith 07123456789 (0.24s)
2025-07-09 00:23:17,621 - src.testing.e2e_framework - ERROR -   Error: Field 'phone' failed validation rule: {'type': 'regex', 'pattern': '^07\\d{9}$'}
2025-07-09 00:23:17,621 - src.testing.e2e_framework - INFO - 📋 Running test 2/4: command
2025-07-09 00:23:17,666 - src.testing.e2e_framework - INFO - ✅ Message sent: /register JS...
2025-07-09 00:23:17,732 - src.testing.e2e_framework - INFO - ✅ PASS Test 2: Command + Validation: /register JS (0.11s)
2025-07-09 00:23:17,732 - src.testing.e2e_framework - INFO - 📋 Running test 3/4: natural_language
2025-07-09 00:23:17,779 - src.testing.e2e_framework - INFO - ✅ Message sent: What's my registration status?...
2025-07-09 00:23:17,819 - src.testing.e2e_framework - INFO - ✅ PASS Test 3: NL: What's my registration status? (0.09s)
2025-07-09 00:23:17,819 - src.testing.e2e_framework - INFO - 📋 Running test 4/4: command
2025-07-09 00:23:17,866 - src.testing.e2e_framework - INFO - ✅ Message sent: /approve JS...
2025-07-09 00:23:17,947 - src.testing.e2e_framework - INFO - ❌ FAIL Test 4: Command + Validation: /approve JS (0.13s)
2025-07-09 00:23:17,947 - src.testing.e2e_framework - ERROR -   Error: Required field 'status' not found
2025-07-09 00:23:17,947 - src.testing.e2e_framework - INFO -  Test suite completed. 2/4 tests passed
2025-07-09 00:23:17,947 - __main__ - INFO - 

🧪 KICKAI E2E Test Report
==================================================

📊 Summary:
• Total Tests: 4
• Passed: 2 (50.0%)
• Failed: 2 (50.0%)
• Average Duration: 0.14s

📋 Test Types:
• Integration: 3
• Natural_Language: 1

️ Performance:
• Total Duration: 0.57s
• Fastest Test: 0.09s
• Slowest Test: 0.24s

❌ Failed Tests:
• Command + Validation: /add John Smith 07123456789
  - Field 'phone' failed validation rule: {'type': 'regex', 'pattern': '^07\\d{9}$'}
• Command + Validation: /approve JS
  - Required field 'status' not found

2025-07-09 00:23:17,947 - __main__ - INFO - 📄 Detailed report saved to: e2e_report_player_registration_20250709_002317.html
2025-07-09 00:23:17,947 - __main__ - ERROR - ❌ 2 tests failed
2025-07-09 00:23:17,947 - __main__ - INFO - 🧹 Cleaning up...
2025-07-09 00:23:17,947 - telethon.network.mtprotosender - INFO - Disconnecting from 149.154.167.91:443/TcpFull...
2025-07-09 00:23:17,948 - telethon.network.mtprotosender - INFO - Disconnection from 149.154.167.91:443/TcpFull complete!
2025-07-09 00:23:17,948 - src.testing.e2e_framework - INFO - ✅ Telegram client stopped
2025-07-09 00:23:17,948 - __main__ - INFO - ✅ Cleanup completed
