2025-07-09 00:23:32,442 - __main__ - INFO - 🧪 KICKAI E2E Test Runner
2025-07-09 00:23:32,442 - __main__ - INFO - 📋 Available suites: chat_id_validation, player_registration, match_management, payment_processing, natural_language, admin_operations, comprehensive, smoke
2025-07-09 00:23:32,442 - __main__ - INFO - 🚀 Starting test suite: chat_id_validation
2025-07-09 00:23:32,442 - __main__ - INFO -  Validating environment configuration...
2025-07-09 00:23:32,442 - __main__ - INFO - ✅ TELEGRAM_BOT_TOKEN: 76933590...NYsM
2025-07-09 00:23:32,442 - __main__ - INFO - ✅ TELEGRAM_API_ID: 23493061
2025-07-09 00:23:32,442 - __main__ - INFO - ✅ TELEGRAM_API_HASH: bd2e45dd...e6a5
2025-07-09 00:23:32,442 - __main__ - INFO - ✅ ADMIN_SESSION_STRING: 1BJWap1s...vvY=
2025-07-09 00:23:32,443 - __main__ - INFO - ✅ TELEGRAM_MAIN_CHAT_ID: -4889304885
2025-07-09 00:23:32,443 - __main__ - INFO - ✅ TELEGRAM_LEADERSHIP_CHAT_ID: -4814449926
2025-07-09 00:23:32,443 - __main__ - INFO - ✅ DEFAULT_TEAM_ID: KAI
2025-07-09 00:23:32,443 - __main__ - INFO - ✅ FIREBASE_PROJECT_ID: kickai-954c2
2025-07-09 00:23:32,443 - __main__ - INFO - ✅ Environment validation passed
2025-07-09 00:23:32,443 - __main__ - INFO - 📱 Chat Configuration:
2025-07-09 00:23:32,443 - __main__ - INFO -    Main Chat ID: -4889304885 (KickAI Testing)
2025-07-09 00:23:32,443 - __main__ - INFO -    Leadership Chat ID: -4814449926 (KickAI Testing - Leadership)
2025-07-09 00:23:32,443 - __main__ - INFO -    Naming Convention: 'Team Name' for main, 'Team Name - Leadership' for leadership
2025-07-09 00:23:32,443 - src.core.improved_config_system - INFO - E2E testing detected, loading .env.test
2025-07-09 00:23:32,444 - src.core.improved_config_system - INFO - Loaded environment variables from .env.test
2025-07-09 00:23:32,444 - src.core.improved_config_system - INFO -  EnvironmentConfigurationSource.load_configuration called
2025-07-09 00:23:32,445 - src.core.improved_config_system - INFO - Loaded configuration from EnvironmentConfigurationSource
2025-07-09 00:23:32,445 - src.core.improved_config_system - INFO - Loaded configuration from DefaultConfigurationSource
2025-07-09 00:23:32,445 - src.core.improved_config_system - INFO -  Merged configuration AI section: {'provider': <AIProvider.OLLAMA: 'ollama'>, 'api_key': 'ollama_local', 'model_name': 'llama3.1:8b-instruct-q4_0', 'temperature': 0.7, 'max_tokens': 1000, 'timeout_seconds': 60, 'source': <ConfigSource.ENVIRONMENT: 'environment'>}
2025-07-09 00:23:32,445 - src.core.improved_config_system - INFO - Configuration validation passed
2025-07-09 00:23:32,445 - __main__ - INFO - 📋 Team ID: KAI
2025-07-09 00:23:32,445 - __main__ - INFO - 🔧 Initializing test components...
2025-07-09 00:23:32,445 - src.testing.e2e_framework - INFO - ✅ TelegramBotTester initialized
2025-07-09 00:23:32,507 - src.testing.e2e_framework - INFO - ✅ FirestoreValidator initialized for project kickai-954c2
2025-07-09 00:23:32,507 - __main__ - INFO - 📱 Starting Telegram tester...
2025-07-09 00:23:32,507 - telethon.network.mtprotosender - INFO - Connecting to 149.154.167.91:443/TcpFull...
2025-07-09 00:23:32,536 - telethon.network.mtprotosender - INFO - Connection to 149.154.167.91:443/TcpFull complete!
2025-07-09 00:23:33,166 - src.testing.e2e_framework - INFO - ✅ Telegram client started
2025-07-09 00:23:33,167 - __main__ - INFO - ✅ Telegram tester started successfully
2025-07-09 00:23:33,167 - src.testing.e2e_framework - INFO - ✅ E2ETestRunner initialized
2025-07-09 00:23:33,167 - src.utils.id_generator - INFO - Generated player ID 'JS' for 'John Smith'
2025-07-09 00:23:33,167 - src.utils.id_generator - INFO - Generated player ID 'JS1' for 'John Smith'
2025-07-09 00:23:33,167 - __main__ - INFO - 📋 Loaded 1 tests for suite 'chat_id_validation'
2025-07-09 00:23:33,167 - __main__ - INFO -    1. Main Chat ID Validation
2025-07-09 00:23:33,167 - __main__ - INFO - 🧪 Running tests...
2025-07-09 00:23:33,167 - src.testing.e2e_framework - INFO - 🚀 Starting E2E test suite with 1 tests
2025-07-09 00:23:33,167 - src.testing.e2e_framework - INFO - 📋 Running test 1/1: validation
2025-07-09 00:23:33,167 - src.testing.e2e_framework - ERROR - ❌ Test 1 failed with exception: 'validation'
2025-07-09 00:23:33,167 - src.testing.e2e_framework - INFO -  Test suite completed. 0/1 tests passed
2025-07-09 00:23:33,167 - __main__ - INFO - 

🧪 KICKAI E2E Test Report
==================================================

📊 Summary:
• Total Tests: 1
• Passed: 0 (0.0%)
• Failed: 1 (100.0%)
• Average Duration: 0.00s

📋 Test Types:
• Integration: 1

️ Performance:
• Total Duration: 0.00s
• Fastest Test: 0.00s
• Slowest Test: 0.00s

❌ Failed Tests:
• Test 1
  - 'validation'

2025-07-09 00:23:33,167 - __main__ - INFO - 📄 Detailed report saved to: e2e_report_chat_id_validation_20250709_002333.html
2025-07-09 00:23:33,168 - __main__ - ERROR - ❌ 1 tests failed
2025-07-09 00:23:33,168 - __main__ - INFO - 🧹 Cleaning up...
2025-07-09 00:23:33,168 - telethon.network.mtprotosender - INFO - Disconnecting from 149.154.167.91:443/TcpFull...
2025-07-09 00:23:33,168 - telethon.network.mtprotosender - INFO - Disconnection from 149.154.167.91:443/TcpFull complete!
2025-07-09 00:23:33,168 - src.testing.e2e_framework - INFO - ✅ Telegram client stopped
2025-07-09 00:23:33,168 - __main__ - INFO - ✅ Cleanup completed
